{
  "schemaVersion": 2,
  "global": {
    "backendPath": "~~/scripts/iinatan/bin/iinatan-backend",
    "ffmpegPath": "~~/scripts/iinatan/bin/ffmpeg",
    "logPath": "~~state/iinatan/iinatan.log",
    "lowRamImport": true,
    "recommendedDictionaries": [
      {
        "title": "Jitendex (Japanese → English)",
        "url": "https://github.com/stephenmk/stephenmk.github.io/releases/latest/download/jitendex-yomitan.zip"
      }
    ]
  },
  "dictionaries": [],
  "pendingDictionaries": [],
  "activeProfileId": "default",
  "profiles": {
    "default": {
      "name": "Default",
      "enabled": true,
      "dictionaries": [],
      "lookupLanguage": "ja",
      "scanLength": 24,
      "maxEntries": 3,
      "maxGlossesPerEntry": 4,
      "lookupTimeoutMs": 9000,
      "subtitleLookupMode": "hover",
      "flattenSubtitleLineBreaks": false,
      "pauseWhilePopupVisible": true,
      "nestedPopupMode": "off",
      "nestedPopupMaxDepth": 3,
      "popupScale": 0.92,
      "popupMinWidth": 250,
      "popupMaxWidth": 440,
      "popupMaxHeightVh": 34,
      "popupSubtitleGapPx": 24,
      "theme": {
        "preset": "dark",
        "background": "181a20",
        "foreground": "f4f4f5",
        "accent": "8ab4f8",
        "muted": "a1a1aa",
        "border": "3f3f46"
      },
      "audio": { "autoPlay": false, "sources": [] },
      "ocr": { "enabled": true, "prefetch": false, "screenshotFallback": false },
      "anki": {
        "enabled": false,
        "connectUrl": "http://127.0.0.1:8765",
        "timeoutSeconds": 3,
        "deck": "",
        "model": "",
        "fields": {},
        "tags": ["iinatan"],
        "duplicateMode": "prevent",
        "duplicateScope": "deck",
        "audioFormat": "mp3",
        "audioBitrateKbps": 96,
        "imageQuality": 85,
        "sentenceAudioPaddingMs": 250
      }
    }
  },
  "migration": { "archivedCustomCss": "" }
}
